PermitNum,MasterPermitNum,Description,AppliedDate,IssuedDate,CompletedDate,StatusCurrent,OriginalAddress,OriginalCity,OriginalState,OriginalZip,PIN,ProjectName,PermitType,PermitWorkType,EstProjectCost,EstPhotovoltaicCost,EstSolarCost,NewHousingUnits,ExistingHousingUnits,AffordableHousingUnits,RemovedHousingUnits,AddedSqFt,RemodeledSqFt,RemovedResSqFt,RemovedNonResSqFt,RemovedParkingStructureSqFt,RemovedDescription,PhotovoltaicKilowatt,PhotovoltaicElecVehicleOffset,ElecVehicleChargeStation,SolarSystemDescription,ContractorCompanyName,ContractorTrade,ObjectId
UTL2021-00251,BLD-NRE2020-00214,"*Alteration Level 2 (COBECC) of an existing 22,721 SF industrial building to a ""White Box"".  No new/additional floor area is proposed.  No change to the existing B (office) occupancy proposed. Facade alterations to the entry canopies.  No change in building height proposed.  Minimal site improvements to add accessible route from parking to building entries.",3/8/2021,3/19/2021,,Issued,2865 WILDERNESS PL,BOULDER,CO,80301,1.46329E+11,,Utility Permit,Utility Sub-Permit,0,,,,,,,,,,,,,,,,,"WYATT CONSTRUCTION CO, INC",Contractor: General,439
ELE2021-00341,,"Add 240v dedicated A/C circuit and Disconnect box to west side of house.
Add GFCI service outlet on west side.",3/7/2021,,,Payment Pending,502 MAPLETON AVE,BOULDER,CO,80302,1.46125E+11,,Electrical Permit,Electrical Permit,600,,,,,,,,,,,,,,,,,SANA CUSTOM BUILDERS,Contractor: General,440
MEC2021-00409,,"Add mini split unit to west side of house.
System will have 1 outdoor unit and 3 indoor heads.
Applied for an electrical permit to add 240V dedicated circuit with gfci service outlet for new unit",3/7/2021,,,Payment Pending,502 MAPLETON AVE,BOULDER,CO,80302,1.46125E+11,,Mechanical Permit,Mechanical HVAC/Solar,8801.6,,,,,,,,,,,,,,,,,Essential Elements Mechanical LLC,Contractor: Mechanical,441
BLD-ACC2021-00027,,Inground shotcrete swimming pool and spa,3/5/2021,,,Pending at Applicant,2088 RIVERSIDE LN,BOULDER,CO,80304,1.46318E+11,,Building Permit - Accessory,New,72620.9,,,,1,,,549,,,,,,,,,,INTEGRITY POOL BUILDERS,Contractor: General,442
BLD-NRE2021-00031,,"Suite 360: Tenant finish remodel of existing space including splitting existing room in half and one side becoming consult and the other recovery, new millwork for shared office and new millwork and sink for new treatment room.",3/5/2021,,,Pending at Applicant,2595 CANYON BLVD,BOULDER,CO,80302,1.46329E+11,,Building Permit - Non-Residential,Remodel,44795,,,,,,,,500,,,,,,,,,Waiting for Licensed Contractor,Contractor: General,443
BLD-SFD2021-00097,,"Kitchen remodel of 115 sf. New exterior doors along kitchen and dining room exterior wall. Relocation of existing laundry fixtures from unconditioned garage to newly reclaimed finished square footage in garage. The new conditioned space in the garage is 66 sf. Relocation of existing upgraded electrical panel within the existing garage. New high efficiency on-demand hot water heater & furnace. Relocation of existing powder room fixtures to the new addition, shower added to make for a 3/4 bath. Total area of new one story addition is 225 sq ft.  *All work done in garage allows for a 19? required off street parking space in the existing garage.",3/5/2021,,,In Review,3125 23RD ST,BOULDER,CO,80304,1.46319E+11,,Building Permit - Single Family Detached Dwelling,Addition and Remodel,99000,,,,,,,225,181,,,,,,,,,Waiting for Licensed Contractor,Contractor: General,444
BLD-SFD2021-00098,,Remodel to existing kitchen (124 sq ft) and bathroom (60 sq ft) for a single family detached dwelling. Scope includes conversion of one existing bedroom into a mudroom and pantry.,3/5/2021,,,Pending at Applicant,3170 17TH ST,BOULDER,CO,80304,1.46319E+11,,Building Permit - Single Family Detached Dwelling,Remodel,191000,,,,,,,,184,,,,,,,,,SOBO DESIGN & BUILD,Contractor: General,445
ELE2021-00333,,Supply Temp power to allow for excavation,3/5/2021,3/5/2021,3/15/2021,Closed,1650 ORCHARD AVE,BOULDER,CO,80304,1.46318E+11,,Electrical Permit,Temporary Construction Power,0,,,,,,,,,,,,,,,,,"BAR ELECTRIC CO, INC",Contractor: Electrical,446
ELE2021-00334,,21.35 roof mounted solar and energy storage,3/5/2021,3/19/2021,,Issued,1431 UPLAND AVE,BOULDER,CO,80304,1.46318E+11,,Electrical Permit,Electrical Permit,63000,63000,,,,,,,,,,,,21.35,,,,PHOTON BROTHERS,Contractor: Electrical,447
ELE2021-00335,,Temporary electric power for asbestos mitigation and demolition of 2150 Folsom. 2120 and 2160 construction permits are approved and ready for pickup.,3/5/2021,,,Pending at Applicant,2120 FOLSOM ST,BOULDER,CO,80302,1.46331E+11,,Electrical Permit,Temporary Construction Power,0,,,,,,,,,,,,,,,,,SOUTH PAW ELECTRIC CO,Contractor: Electrical,448
ELE2021-00336,,Repair wiring where damaged by water,3/5/2021,3/8/2021,,Issued,1453 BROADWAY,BOULDER,CO,80302,1.46331E+11,,Electrical Permit,Electrical Permit,5000,,,,,,,,,,,,,,,,,PRODUCTIVE ELECTRIC LLC,Contractor: Electrical,449
ELE2021-00337,,"new ac circuit, new circuit breaker and GFCI if needed",3/5/2021,3/8/2021,,Issued,2830 DUKE CIR,BOULDER,CO,80305,1.57708E+11,,Electrical Permit,Electrical Permit,429,,,,,,,,,,,,,,,,,COOPER HEATING & COOLING INC,Contractor: Electrical,450
MEC2021-00357,,"Install replacement furnace 80% 100,000 BTU",2/25/2021,2/26/2021,,Issued,3153 NOBLE CT,BOULDER,CO,80301,1.46321E+11,,Mechanical Permit,Mechanical HVAC/Solar,7476,,,,,,,,,,,,,,,,,PRECISION PLUMBING & HEATING,Contractor: Mechanical,451
ELE2021-00355,,install (3) new post lights in a dark area of the south parking lot per the attached drawings.,3/10/2021,,,In Review,3030 ONEAL PKWY,BOULDER,CO,80301,1.4632E+11,,Electrical Permit,Electrical Permit,6870,,,,,,,,,,,,,,,,,LIGHTING BUG ELECTRIC LLC,Contractor: Electrical,452
MEC2021-00358,,Replace furnace,2/25/2021,3/18/2021,,Issued,2897 VALMONT RD,BOULDER,CO,80301,1.4632E+11,,Mechanical Permit,Mechanical HVAC/Solar,3480,,,,,,,,,,,,,,,,,MEYERS HEATING AND A/C,Contractor: Mechanical,453
MEC2021-00359,,Replace failed water heater. ,2/25/2021,2/26/2021,,Issued,4870 MEREDITH WAY 106,BOULDER,CO,80303,1.46333E+11,,Mechanical Permit,Mechanical HVAC/Solar,2200,,,,,,,,,,,,,,,,,"PLANET PLUMBING, INC",Contractor: General,454
MEC2021-00360,,Installation of AC,2/25/2021,,,Pending at Applicant,1005 ROXWOOD LN,BOULDER,CO,80303,1.46333E+11,,Mechanical Permit,Mechanical HVAC/Solar,4225,,,,,,,,,,,,,,,,,MEYERS HEATING AND A/C,Contractor: Mechanical,455
MEC2021-00361,,Replace 40 gallon water heater. ,2/25/2021,2/26/2021,,Issued,3850 BROADWAY 19,BOULDER,CO,80304,1.46318E+11,,Mechanical Permit,Mechanical HVAC/Solar,2400,,,,,,,,,,,,,,,,,"PLANET PLUMBING, INC",Contractor: General,456
MEC2021-00362,,Installation of ductless Ac,2/25/2021,3/18/2021,3/19/2021,Letter of Completion,1319 ALPINE AVE 24,BOULDER,CO,80304,1.4633E+11,,Mechanical Permit,Mechanical HVAC/Solar,3825,,,,,,,,,,,,,,,,,MEYERS HEATING AND A/C,Contractor: Mechanical,457
MEC2021-00363,,Installation of Central AC,2/25/2021,,,Pending at Applicant,4290 DARLEY AVE,BOULDER,CO,80305,1.57708E+11,,Mechanical Permit,Mechanical HVAC/Solar,4300,,,,,,,,,,,,,,,,,MEYERS HEATING AND A/C,Contractor: Mechanical,458
PLB2021-00113,,"replaced 50 gallon power direct vent water heater with new ""like for like""",2/25/2021,,2/26/2021,Void,201 DAKOTA BLVD,BOULDER,CO,80304,1.46112E+11,,Plumbing Permit,Plumbing Permit,2500,,,,,,,,,,,,,,,,,TYCO PLUMBING CORPORATION,Contractor: Plumbing,459
PLB2021-00114,,interior sanitary sewer repair,2/25/2021,2/26/2021,3/16/2021,Withdrawn,2972 IRIS AVE,BOULDER,CO,80301,1.4632E+11,,Plumbing Permit,Plumbing Permit,793,,,,,,,,,,,,,,,,,ELITE ROOTER,Contractor: General,460
RFG2021-00059,,"*Total tear-off & reroof of SFD, 20 squares of tile shingles on a pitch represented as 4/12. All roof materials shall be installed per manufacturer?s specs.  Mid-roof inspection required if pitch is less than 4/12. All roof covering materials shall be listed as Class A as tested in accordance with UL Standard 790 or ASTM Standard E 108. At inspection, provide to building inspection staff original wrappers of materials used or applied. Provide additional information -- such as manufacturer's cut sheet for other products used - including, but not limited to, items such as flashing, valley material, sealants, fasteners, ventilation devices or features and roof jacks & penetration boots. 
replace Tesla Solar Pv Roof -ELE2021-00298",2/25/2021,2/26/2021,,Issued,1535 GILLASPIE DR,BOULDER,CO,80305,1.57708E+11,,Roofing Replacement Permit,Roofing Replacement Permit,28990,,,,,,,,,,,,,,,,,"WEDDLE PROFESSIONAL ROOFING, INC",Contractor: General,461
ROW2021-00204,,"Replace OH pole deemed unsafe, job# 104319073",2/25/2021,2/26/2021,,Issued,2660 HEIDELBERG DR,BOULDER,CO,80305,1.57708E+11,,Right-of-Way Permit,Right-of-Way Permit,0,,,,,,,,,,,,,,,,,Xcel Energy,Contractor: Right-of-Way,462
ROW2021-00205,,Oversize move permit for two occasions. 2-25-21 to 2-27-21 Night/early mornings only between 10pm and 5am.,2/25/2021,2/25/2021,,Issued,1600 COMMERCE ST,BOULDER,CO,80301,1.46328E+11,,Right-of-Way Permit,Right-of-Way Permit,0,,,,,,,,,,,,,,,,,Waiting for Licensed Contractor,Contractor: Right-of-Way,463
ROW2021-00206,,Occupy ROW to prune trees. 9am to 3pm only.,2/25/2021,2/25/2021,,Issued,2219 ARAPAHOE AVE,BOULDER,CO,80302,1.46331E+11,,Right-of-Way Permit,Right-of-Way Permit,0,,,,,,,,,,,,,,,,,TADDIKEN TREE CO,Contractor: Right-of-Way,464
ELE2021-00338,BLD-SFD2021-00097,"Kitchen remodel of 115 sf. New exterior doors along kitchen and dining room exterior wall. Relocation of existing laundry fixtures from unconditioned garage to newly reclaimed finished square footage in garage. The new conditioned space in the garage is 66 sf. Relocation of existing upgraded electrical panel within the existing garage. New high efficiency on-demand hot water heater & furnace. Relocation of existing powder room fixtures to the new addition, shower added to make for a 3/4 bath. Total area of new one story addition is 225 sq ft.  *All work done in garage allows for a 19? required off street parking space in the existing garage.",3/5/2021,,,Received,3125 23RD ST,BOULDER,CO,80304,1.46319E+11,,Electrical Permit,Electrical Sub-Permit,10500,,,,,,,,,,,,,,,,,Waiting for Licensed Contractor,Contractor: General,465
ELE2021-00325,BLD-SFD2021-00095,"AN 835 SF INTERIOR BASEMENT FINISH REMODEL. PROJECT INCLUDES 3 (N) BEDROOMS AT (E) EGRESS WINDOWS, 1 (N) 3/4 BATH AT (E) PLUMBING STUB-INS, (N) WETBAR AT (E) PLUMBING STUB IN, (N) ELECTRICAL & LIGHTING.


EXISTING BASEMENT IS CONDITIONED & (E) EXTERIOR WALLS ARE INSULATED W/ 3"" BLANKET INSUL (ASSUMED R-11).",3/3/2021,,,Received,3097 OURAY ST,BOULDER,CO,80301,1.4632E+11,,Electrical Permit,Electrical Sub-Permit,8000,,,,,,,,,,,,,,,,,Deborah Galea,Owner/Contractor,466
ROW2021-00207,,"Crane setup and road closure to remove tree behind home. 72 hours notice required to police/fire dispatch, properties affected in area and to ROWinspectionRequest@bouldercolorado.gov ***",2/25/2021,2/25/2021,3/5/2021,Letter of Completion,896 17TH ST,BOULDER,CO,80302,1.46331E+11,,Right-of-Way Permit,Right-of-Way Permit,0,,,,,,,,,,,,,,,,,"MILE HIGH TREE CARE, INC.",Contractor: Right-of-Way,467
ROW2021-00208,,"Repalce OH poles deemed unsafe at 3 locations: 3065 9th, 901 Dellwood, 2910 10th, WO#'s 104321377, 104321370, 104321369  ",2/25/2021,2/26/2021,,Issued,3065 9TH ST,BOULDER,CO,80304,1.46124E+11,,Right-of-Way Permit,Right-of-Way Permit,0,,,,,,,,,,,,,,,,,Xcel Energy,Contractor: Right-of-Way,468
ROW2021-00209,,"Replace OH poles deemed unsafe at (3) locations: 2805, 2815 & 2735 7th St,  WO# 104321366 ",2/25/2021,2/26/2021,,Issued,2805 7TH ST,BOULDER,CO,80304,1.46125E+11,,Right-of-Way Permit,Right-of-Way Permit,0,,,,,,,,,,,,,,,,,STURGEON ELECTRIC COMPANY INC,Contractor: Right-of-Way,469
UTL2021-00216,,"Replace OH pole deemed unsafe, job# 104319073",2/25/2021,2/26/2021,,Issued,2660 HEIDELBERG DR,BOULDER,CO,80305,1.57708E+11,,Utility Permit,Utility Permit,0,,,,,,,,,,,,,,,,,Xcel Energy,Contractor: Right-of-Way,470
UTL2021-00217,,"Repalce OH poles deemed unsafe at 3 locations: 3065 9th, 901 Dellwood, 2910 10th, WO#'s 104321377, 104321370, 104321369  ",2/25/2021,2/26/2021,,Issued,3065 9TH ST,BOULDER,CO,80304,1.46124E+11,,Utility Permit,Utility Permit,0,,,,,,,,,,,,,,,,,Xcel Energy,Contractor: Right-of-Way,471
UTL2021-00218,,"Replace OH poles deemed unsafe at (3) locations: 2805, 2815 & 2735 7th St,  WO# 104321366 ",2/25/2021,2/26/2021,,Issued,2805 7TH ST,BOULDER,CO,80304,1.46125E+11,,Utility Permit,Utility Permit,0,,,,,,,,,,,,,,,,,STURGEON ELECTRIC COMPANY INC,Contractor: Right-of-Way,472
BLD-ACC2021-00025,,New 520 sf unconditioned garage.,2/24/2021,,3/23/2021,Withdrawn,2680 LAFAYETTE DR,BOULDER,CO,80305,1.57717E+11,,Building Permit - Accessory,New,75000,,,,,,,520,,,,,,,,,,Waiting for Licensed Contractor,Contractor: General,473
BLD-SFD2021-00087,,"Project: Level 2 Alterations. No new square footage added. Exterior scope: Replace all exterior stucco (plaster), windows and doors. Add new 118SF front balcony and re-build and expand existing 400SF rear deck to be 497SF while removing existing 300SF lower deck. Replace and expand existing front porch to 121SF and extend existing roof to cover new front porch area. Interior: Lower level ? alter existing and construct new walls in the existing 886SF space. The existing 2 bed/1 bath + office space altered to be 2 bed/2 bath (no office). Replace mechanical systems (HVAC & Water Heater) in the lower mechanical closet with new HVAC and a tankless water heater. Interior: Upper level - alter existing and construct new walls in the existing 1765SF space. The existing 2 bed/2.5 bath area will be altered to be 1 bed/1.5 bath. The existing 250 SF mater bedroom will become the living room. The existing master bathroom undergoes no alterations. The existing 200 SF living room will become an office. The existing 220 SF kitchen area will be remodeled with new cabinets and appliances. Throughout ? new paint, finishes, recessed lighting to LED.",2/24/2021,,,In Review,3470 LONGWOOD AVE,BOULDER,CO,80305,1.57717E+11,,Building Permit - Single Family Detached Dwelling,Addition and Remodel,300000,,,,,,,615,2250,,,,,,,,,Waiting for Licensed Contractor,Contractor: General,474
BLD-SFD2021-00088,,"Remodel Kitchen and Bath: Kitchen Remodel of 205 sf. Master Bathroom remodel of 105sf.  Relocate washer/dryer in laundry Room and add cabinets, 157 sf. Add a new cabinet at existing Hall Bathroom. Total remodel 467 sf. Total sf of home is 1928 sf. Upgrade Electrical:  Replace breaker panel, rewire and update lighting at original part of the house (circa1956). Update lighting at remaining area of home (addition circa 1990's by previous owners). Install LED fixtures. Upgrade Energy Efficiency: Replace  HVAC and Hot Water Heater with new high efficiency equipment and relocate from crawl space to existing Mud/Laundry/Mechanical Room. Upgrade Thermal Envelope:  Seal off vents in crawl space and add perimeter foundation wall insulation. Add floor insulation at existing Laundry room and the 1990's addition. Replace all existing exterior single glazed windows with insulated glass units. Remove and replace attic insulation with R-49.",2/24/2021,,,In Review,3640 DARTMOUTH AVE,BOULDER,CO,80305,1.57705E+11,,Building Permit - Single Family Detached Dwelling,Addition and Remodel,136000,,,,1,,,,467,,,,,,,,,Jessica Pault-Atiase,Owner/Contractor,475
BLD-SFD2021-00089,,After the fact permit for kitchen plumbing in ADU. ADU approved under AUR2020-00049,2/24/2021,,,In Review,2675 3RD ST,BOULDER,CO,80304,1.46125E+11,TRAILHEAD,Building Permit - Single Family Detached Dwelling,Remodel,2994.42,,,,,,,,12,,,,,,,,,Waiting for Licensed Contractor,Contractor: General,476
BLD-SFD2021-00090,,"Kitchen remodel of 172 Sq Ft, New window.",2/24/2021,,,Revisions - Resubmit,2167 JORDAN PL,BOULDER,CO,80304,1.46319E+11,,Building Permit - Single Family Detached Dwelling,Remodel,89000,,,,,,,,172,,,,,,,,,SOBO DESIGN & BUILD,Contractor: General,477
BLD-SFD2021-00091,,"New 496 sf 2 level addition. Remodel existing kitchen, bedroom, 2 new bathrooms, expanding existing deck.",2/24/2021,,,In Review,1408 KALMIA AVE,BOULDER,CO,80304,1.46319E+11,,Building Permit - Single Family Detached Dwelling,Addition and Remodel,310000,,,,,,,780,274,,,,,,,,,SOBO DESIGN & BUILD,Contractor: General,478
BLD-TWN2021-00002,,Repair 40 square feet of minor framing and replace insulation on south side of structure due to car impact,2/24/2021,2/24/2021,,Issued,301 PEARL ST,BOULDER,CO,80302,1.46125E+11,,Building Permit - Townhome,Repair,3000,,,,6,,,,40,,,,,,,,,SPECIALTY CONTRACTING SERVICES,Contractor: General,479
BLD-TWN2021-00003,,"First-time basement finish, approximately 340 sqft. Scope includes adding a bathroom (toilet, vanity and shower), a separate laundry/utility room, and a great room/bedroom.",2/24/2021,,3/17/2021,Void,611 TANTRA DR,BOULDER,CO,80305,1.57709E+11,,Building Permit - Townhome,Remodel,21149.28,,,,,,,,342,,,,,,,,,Waiting for Licensed Contractor,Contractor: General,480
ELE2021-00289,BLD-SFD2021-00087,"Project: Level 2 Alterations. No new square footage added. Exterior scope: Replace all exterior stucco (plaster), windows and doors. Add new 118SF front balcony and re-build and expand existing 400SF rear deck to be 497SF while removing existing 300SF lower deck. Replace and expand existing front porch to 121SF and extend existing roof to cover new front porch area. Interior: Lower level ? alter existing and construct new walls in the existing 886SF space. The existing 2 bed/1 bath + office space altered to be 2 bed/2 bath (no office). Replace mechanical systems (HVAC & Water Heater) in the lower mechanical closet with new HVAC and a tankless water heater. Interior: Upper level - alter existing and construct new walls in the existing 1765SF space. The existing 2 bed/2.5 bath area will be altered to be 1 bed/1.5 bath. The existing 250 SF mater bedroom will become the living room. The existing master bathroom undergoes no alterations. The existing 200 SF living room will become an office. The existing 220 SF kitchen area will be remodeled with new cabinets and appliances. Throughout ? new paint, finishes, recessed lighting to LED.",2/24/2021,,,Received,3470 LONGWOOD AVE,BOULDER,CO,80305,1.57717E+11,,Electrical Permit,Electrical Sub-Permit,20000,,,,,,,,,,,,,,,,,Waiting for Licensed Contractor,Contractor: General,481
ELE2021-00290,,200amp overhead service upgrade. New exterior panel and grounding. Eliminate interior sub panel and relocate circuits to new exterior panel. Wire furnace to existing circuit. Wire AC to existing circuit install new disconnect and outside service GFI receptacle,2/24/2021,2/25/2021,,Issued,4755 SHOUP PL,BOULDER,CO,80303,1.46333E+11,,Electrical Permit,Electrical Permit,14000,,,,,,,,,,,,,,,,,APPLEWOOD PLUMBING HEATING ELE,Contractor: Electrical,482
ELE2021-00291,,Install of 8.8 kW DC of Solar on roof of house.,2/24/2021,2/25/2021,,Issued,2390 KENWOOD DR,BOULDER,CO,80305,1.57706E+11,,Electrical Permit,Electrical Permit,38000,38000,,,,,,,,,,,,8.8,,,,THE SOLAR REVOLUTION,Contractor: Electrical,483
ELE2021-00292,BLD-SFD2021-00088,"Remodel Kitchen and Bath: Kitchen Remodel of 205 sf. Master Bathroom remodel of 105sf.  Relocate washer/dryer in laundry Room and add cabinets, 157 sf. Add a new cabinet at existing Hall Bathroom. Total remodel 467 sf. Total sf of home is 1928 sf. Upgrade Electrical:  Replace breaker panel, rewire and update lighting at original part of the house (circa1956). Update lighting at remaining area of home (addition circa 1990's by previous owners). Install LED fixtures. Upgrade Energy Efficiency: Replace  HVAC and Hot Water Heater with new high efficiency equipment and relocate from crawl space to existing Mud/Laundry/Mechanical Room. Upgrade Thermal Envelope:  Seal off vents in crawl space and add perimeter foundation wall insulation. Add floor insulation at existing Laundry room and the 1990's addition. Replace all existing exterior single glazed windows with insulated glass units. Remove and replace attic insulation with R-49.",2/24/2021,,,Received,3640 DARTMOUTH AVE,BOULDER,CO,80305,1.57705E+11,,Electrical Permit,Electrical Sub-Permit,14500,,,,,,,,,,,,,,,,,Jessica Pault-Atiase,Owner/Contractor,484
ELE2021-00293,BLD-SFD2021-00090,"Kitchen remodel of 172 Sq Ft, New window.",2/24/2021,,,Received,2167 JORDAN PL,BOULDER,CO,80304,1.46319E+11,,Electrical Permit,Electrical Sub-Permit,11000,,,,,,,,,,,,,,,,,Contractor of Record Not Designated,,485
ELE2021-00294,,"Install a 5.985 kW rid tied, roof flush mounted solar photovoltaic system. All metering must be installed at least 1 foot above grade, 3 feet would be ideal.",2/24/2021,3/1/2021,,Issued,2131 ARAPAHOE AVE 1,BOULDER,CO,80302,1.46331E+11,,Electrical Permit,Electrical Permit,20469,20469,,,,,,,,,,,,5.985,,,,"FREEDOM FOREVER COLORADO, LLC",Contractor: Electrical,486
ELE2021-00295,BLD-ACC2021-00025,New 520 sf unconditioned garage.,2/24/2021,,3/23/2021,Withdrawn,2680 LAFAYETTE DR,BOULDER,CO,80305,1.57717E+11,,Electrical Permit,Electrical Sub-Permit,4000,,,,,,,,,,,,,,,,,Waiting for Licensed Contractor,Contractor: General,487
ELE2021-00296,BLD-SFD2021-00091,"New 496 sf 2 level addition. Remodel existing kitchen, bedroom, 2 new bathrooms, expanding existing deck.",2/24/2021,,,Received,1408 KALMIA AVE,BOULDER,CO,80304,1.46319E+11,,Electrical Permit,Electrical Sub-Permit,19000,,,,,,,,,,,,,,,,,Contractor of Record Not Designated,,488
ELE2021-00297,BLD-TWN2021-00003,"First-time basement finish, approximately 340 sqft. Scope includes adding a bathroom (toilet, vanity and shower), a separate laundry/utility room, and a great room/bedroom.",2/24/2021,,3/17/2021,Void,611 TANTRA DR,BOULDER,CO,80305,1.57709E+11,,Electrical Permit,Electrical Sub-Permit,1500,,,,,,,,,,,,,,,,,GC Assumes Responsibility for Subcontracted Work,Contractor: Electrical,489
FIR2021-00071,,Adding/relocating 23 sprinklers to meet code coverage for new wall & ceiling layout. See BLD-NRE-2020-00172 for general building permit. KENISIS DANCE STUDIO,2/24/2021,2/25/2021,,Issued,635 S BROADWAY,BOULDER,CO,80305,1.57708E+11,,Fire Permit,Fire Permit,1265,,,,,,,,,,,,,,,,,"FREEDOM FIRE PROTECTION, LLC",Contractor: Fire,490
MEC2021-00338,,Replace Furnace and Water heater. Like for Like.,2/24/2021,3/1/2021,,Issued,2270 HILLSDALE CIR,BOULDER,CO,80305,1.57707E+11,,Mechanical Permit,Mechanical HVAC/Solar,6338,,,,,,,,,,,,,,,,,"SAVE HOME HEAT CO, INC",Contractor: General,491
MEC2021-00339,,Replace Ac unit. Like for Like.,2/24/2021,3/2/2021,,Issued,3890 26TH ST,BOULDER,CO,80304,1.46317E+11,,Mechanical Permit,Mechanical HVAC/Solar,5540,,,,,,,,,,,,,,,,,"SAVE HOME HEAT CO, INC",Contractor: General,492
MEC2021-00340,,Replace Furnace. Like for Like.,2/24/2021,3/2/2021,,Issued,190 S 32ND ST,BOULDER,CO,80305,1.57705E+11,,Mechanical Permit,Mechanical HVAC/Solar,5567,,,,,,,,,,,,,,,,,"SAVE HOME HEAT CO, INC",Contractor: General,493
MEC2021-00341,,"Installing new furnace in same location as old. 77,000 BTU, 80% efficient with flue and 2 extensions, thermostat and co detectors.",2/24/2021,,,Payment Pending,4500 19TH ST 416,BOULDER,CO,80304,1.46318E+11,,Mechanical Permit,Mechanical HVAC/Solar,4484,,,,,,,,,,,,,,,,,BOB'S HEATING & AIR COND,Contractor: Mechanical,494
MEC2021-00342,,Installation of gas line for the owner's gas firepit and 5 patio heaters,2/24/2021,2/25/2021,,Issued,1515 SUNSET BLVD,BOULDER,CO,80304,1.4633E+11,,Mechanical Permit,Mechanical HVAC/Solar,2745,,,,,,,,,,,,,,,,,"The Gas Connection, Inc.",Contractor: Mechanical,495
MEC2021-00343,BLD-SFD2021-00087,"Project: Level 2 Alterations. No new square footage added. Exterior scope: Replace all exterior stucco (plaster), windows and doors. Add new 118SF front balcony and re-build and expand existing 400SF rear deck to be 497SF while removing existing 300SF lower deck. Replace and expand existing front porch to 121SF and extend existing roof to cover new front porch area. Interior: Lower level ? alter existing and construct new walls in the existing 886SF space. The existing 2 bed/1 bath + office space altered to be 2 bed/2 bath (no office). Replace mechanical systems (HVAC & Water Heater) in the lower mechanical closet with new HVAC and a tankless water heater. Interior: Upper level - alter existing and construct new walls in the existing 1765SF space. The existing 2 bed/2.5 bath area will be altered to be 1 bed/1.5 bath. The existing 250 SF mater bedroom will become the living room. The existing master bathroom undergoes no alterations. The existing 200 SF living room will become an office. The existing 220 SF kitchen area will be remodeled with new cabinets and appliances. Throughout ? new paint, finishes, recessed lighting to LED.",2/24/2021,,,Received,3470 LONGWOOD AVE,BOULDER,CO,80305,1.57717E+11,,Mechanical Permit,Mechanical Sub-Permit,20000,,,,,,,,,,,,,,,,,Waiting for Licensed Contractor,Contractor: General,496
MEC2021-00344,,Install replacement 40 gallon water heater,2/24/2021,2/25/2021,,Issued,635 NORTHSTAR CT,BOULDER,CO,80304,1.46113E+11,,Mechanical Permit,Mechanical HVAC/Solar,3240,,,,,,,,,,,,,,,,,PRECISION PLUMBING & HEATING,Contractor: Mechanical,497
